{
  "version": "2",
  "repo": {
    "full_name": "bytedance/Lance",
    "url": "https://github.com/bytedance/Lance"
  },
  "global": {
    "title": "Lance",
    "total_duration": 180.0,
    "resolution": [
      1920,
      1080
    ],
    "fps": 30,
    "bgm_track": "bgm_ambient_tech",
    "bgm_volume": 0.2,
    "progress_bar_style": "labeled-bar"
  },
  "segments": [
    {
      "id": "seg_001",
      "type": "hook",
      "label": "开篇",
      "time_start": 0.0,
      "time_end": 13.558441558441558,
      "duration": 13.558441558441558,
      "voiceover": {
        "text": "今天要介绍的是字节跳动刚刚开源的一个重磅项目——Lance",
        "duration_est": 6.779220779220779,
        "splits": [
          {
            "text": "今天要介绍的是字节跳动刚刚开源的一个重磅项目——Lance",
            "time_offset": 0.0
          }
        ]
      },
      "primary_material": "demo-image-01",
      "material_refs": [
        "demo-image-01"
      ],
      "layout": {
        "layout_id": "hero-center",
        "motion_map": {}
      },
      "style": {
        "theme_id": "dark-purple",
        "bg_type": "starfield"
      },
      "audio": {
        "bgm_volume": 0.3,
        "bgm_fade_in": 0.5,
        "sfx": [
          {
            "id": "whoosh",
            "time": 0.2,
            "volume": 0.6
          }
        ]
      },
      "transition_in": "crossfade",
      "transition_out": "crossfade"
    },
    {
      "id": "seg_002",
      "type": "features",
      "label": "核心功能",
      "time_start": 13.558441558441558,
      "time_end": 23.844155844155843,
      "duration": 10.285714285714286,
      "voiceover": {
        "text": "这是一个仅有3B激活参数的原生统一多模态模型",
        "duration_est": 5.142857142857143,
        "splits": [
          {
            "text": "这是一个仅有3B激活参数的原生统一多模态模型",
            "time_offset": 0.0
          }
        ]
      },
      "primary_material": "logo-01",
      "material_refs": [
        "logo-01"
      ],
      "layout": {
        "layout_id": "hero-center",
        "motion_map": {}
      },
      "style": {
        "theme_id": "dark-purple",
        "bg_type": "starfield"
      },
      "audio": {
        "bgm_volume": 0.25,
        "sfx": [
          {
            "id": "pop",
            "time": 0.0,
            "volume": 0.5
          },
          {
            "id": "pop",
            "time": 2.5,
            "volume": 0.5
          },
          {
            "id": "pop",
            "time": 5.0,
            "volume": 0.5
          },
          {
            "id": "pop",
            "time": 7.5,
            "volume": 0.5
          },
          {
            "id": "pop",
            "time": 10.0,
            "volume": 0.5
          }
        ]
      },
      "transition_in": "crossfade",
      "transition_out": "crossfade"
    },
    {
      "id": "seg_003",
      "type": "features",
      "label": "核心功能",
      "time_start": 23.844155844155843,
      "time_end": 36.0,
      "duration": 12.155844155844155,
      "voiceover": {
        "text": "却能在一个框架内同时处理图像和视频的理解、生成和编辑",
        "duration_est": 6.077922077922078,
        "splits": [
          {
            "text": "却能在一个框架内同时处理图像和视频的理解、生成和编辑",
            "time_offset": 0.0
          }
        ]
      },
      "primary_material": "benchmark-01",
      "material_refs": [
        "benchmark-01"
      ],
      "layout": {
        "layout_id": "hero-center",
        "motion_map": {}
      },
      "style": {
        "theme_id": "dark-purple",
        "bg_type": "starfield"
      },
      "audio": {
        "bgm_volume": 0.25,
        "sfx": [
          {
            "id": "pop",
            "time": 0.0,
            "volume": 0.5
          },
          {
            "id": "pop",
            "time": 2.5,
            "volume": 0.5
          },
          {
            "id": "pop",
            "time": 5.0,
            "volume": 0.5
          },
          {
            "id": "pop",
            "time": 7.5,
            "volume": 0.5
          },
          {
            "id": "pop",
            "time": 10.0,
            "volume": 0.5
          }
        ]
      },
      "transition_in": "crossfade",
      "transition_out": "crossfade"
    },
    {
      "id": "seg_004",
      "type": "features",
      "label": "核心功能",
      "time_start": 36.0,
      "time_end": 37.714285714285715,
      "duration": 1.7142857142857142,
      "voiceover": {
        "text": "你没听错",
        "duration_est": 0.8571428571428571,
        "splits": [
          {
            "text": "你没听错",
            "time_offset": 0.0
          }
        ]
      },
      "primary_material": "demo-gif-01",
      "material_refs": [
        "demo-gif-01"
      ],
      "layout": {
        "layout_id": "hero-center",
        "motion_map": {}
      },
      "style": {
        "theme_id": "dark-purple",
        "bg_type": "starfield"
      },
      "audio": {
        "bgm_volume": 0.25,
        "sfx": [
          {
            "id": "pop",
            "time": 0.0,
            "volume": 0.5
          },
          {
            "id": "pop",
            "time": 2.5,
            "volume": 0.5
          },
          {
            "id": "pop",
            "time": 5.0,
            "volume": 0.5
          },
          {
            "id": "pop",
            "time": 7.5,
            "volume": 0.5
          },
          {
            "id": "pop",
            "time": 10.0,
            "volume": 0.5
          }
        ]
      },
      "transition_in": "crossfade",
      "transition_out": "crossfade"
    },
    {
      "id": "seg_005",
      "type": "features",
      "label": "核心功能",
      "time_start": 37.714285714285715,
      "time_end": 66.0,
      "duration": 28.285714285714285,
      "voiceover": {
        "text": "理解、生成、编辑。六个任务。一个模型。传统方法通常需要为每个任务单独训练专门的模型。而 Lance 通过多任务协同训练。让不同任务之间互相增强",
        "duration_est": 14.142857142857142,
        "splits": [
          {
            "text": "理解、生成、编辑",
            "time_offset": 0.0
          },
          {
            "text": "六个任务",
            "time_offset": 1.714285714285714
          },
          {
            "text": "一个模型",
            "time_offset": 2.571428571428571
          },
          {
            "text": "传统方法通常需要为每个任务单独训练专门的模型",
            "time_offset": 3.428571428571428
          },
          {
            "text": "而 Lance 通过多任务协同训练",
            "time_offset": 8.142857142857142
          },
          {
            "text": "让不同任务之间互相增强",
            "time_offset": 11.785714285714285
          }
        ]
      },
      "material_refs": [],
      "layout": {
        "layout_id": "hero-center",
        "motion_map": {}
      },
      "style": {
        "theme_id": "dark-purple",
        "bg_type": "starfield"
      },
      "audio": {
        "bgm_volume": 0.25,
        "sfx": [
          {
            "id": "pop",
            "time": 0.0,
            "volume": 0.5
          },
          {
            "id": "pop",
            "time": 2.5,
            "volume": 0.5
          },
          {
            "id": "pop",
            "time": 5.0,
            "volume": 0.5
          },
          {
            "id": "pop",
            "time": 7.5,
            "volume": 0.5
          },
          {
            "id": "pop",
            "time": 10.0,
            "volume": 0.5
          }
        ]
      },
      "transition_in": "crossfade",
      "transition_out": "crossfade"
    },
    {
      "id": "seg_006",
      "type": "features",
      "label": "核心功能",
      "time_start": 66.0,
      "time_end": 90.0,
      "duration": 23.999999999999996,
      "voiceover": {
        "text": "项目团队在 128 张 A100 GPU 的预算内。从零训练了一个统一的 Transformer 骨干网络。在图像生成基准上。Lance 以 3B 规模达到了接近 7B 开源模型的水平",
        "duration_est": 11.999999999999998,
        "splits": [
          {
            "text": "项目团队在 128 张 A100 GPU 的预算内",
            "time_offset": 0.0
          },
          {
            "text": "从零训练了一个统一的 Transformer 骨干网络",
            "time_offset": 3.370786516853932
          },
          {
            "text": "在图像生成基准上",
            "time_offset": 7.011235955056178
          },
          {
            "text": "Lance 以 3B 规模达到了接近 7B 开源模型的水平",
            "time_offset": 8.089887640449437
          }
        ]
      },
      "material_refs": [],
      "layout": {
        "layout_id": "hero-center",
        "motion_map": {}
      },
      "style": {
        "theme_id": "dark-purple",
        "bg_type": "starfield"
      },
      "audio": {
        "bgm_volume": 0.25,
        "sfx": [
          {
            "id": "pop",
            "time": 0.0,
            "volume": 0.5
          },
          {
            "id": "pop",
            "time": 2.5,
            "volume": 0.5
          },
          {
            "id": "pop",
            "time": 5.0,
            "volume": 0.5
          },
          {
            "id": "pop",
            "time": 7.5,
            "volume": 0.5
          },
          {
            "id": "pop",
            "time": 10.0,
            "volume": 0.5
          }
        ]
      },
      "transition_in": "crossfade",
      "transition_out": "crossfade"
    },
    {
      "id": "seg_007",
      "type": "features",
      "label": "核心功能",
      "time_start": 90.0,
      "time_end": 110.0,
      "duration": 20.0,
      "voiceover": {
        "text": "在视频理解方面。它可以回答关于视频内容的细致问题。比如识别物体的运动方向。或者理解视频中不合理的物理现象",
        "duration_est": 10.0,
        "splits": [
          {
            "text": "在视频理解方面",
            "time_offset": 0.0
          },
          {
            "text": "它可以回答关于视频内容的细致问题",
            "time_offset": 1.4285714285714288
          },
          {
            "text": "比如识别物体的运动方向",
            "time_offset": 4.6938775510204085
          },
          {
            "text": "或者理解视频中不合理的物理现象",
            "time_offset": 6.938775510204081
          }
        ]
      },
      "material_refs": [],
      "layout": {
        "layout_id": "hero-center",
        "motion_map": {}
      },
      "style": {
        "theme_id": "dark-purple",
        "bg_type": "starfield"
      },
      "audio": {